{
  "schemaVersion": "aiops.workflow-canvas.case-manifest/v1",
  "currentActivationPhase": 0,
  "approvedCapabilityTags": [],
  "fixtures": [
    {
      "id": "W0",
      "kind": "workflow",
      "path": "fixtures/W0.json"
    },
    {
      "id": "W1",
      "kind": "workflow",
      "path": "fixtures/W1.json"
    },
    {
      "id": "W2",
      "kind": "workflow",
      "path": "fixtures/W2.json"
    },
    {
      "id": "W3",
      "kind": "workflow",
      "path": "fixtures/W3.json"
    },
    {
      "id": "W4",
      "kind": "workflow",
      "path": "fixtures/W4.json"
    },
    {
      "id": "W5",
      "kind": "workflow",
      "path": "fixtures/W5.json"
    },
    {
      "id": "W6",
      "kind": "workflow",
      "path": "fixtures/W6.json"
    },
    {
      "id": "U-view",
      "kind": "principal",
      "path": "fixtures/U-view.json"
    },
    {
      "id": "U-edit",
      "kind": "principal",
      "path": "fixtures/U-edit.json"
    },
    {
      "id": "U-publish",
      "kind": "principal",
      "path": "fixtures/U-publish.json"
    },
    {
      "id": "U-admin",
      "kind": "principal",
      "path": "fixtures/U-admin.json"
    },
    {
      "id": "Tenant-A",
      "kind": "tenant",
      "path": "fixtures/Tenant-A.json"
    },
    {
      "id": "Tenant-B",
      "kind": "tenant",
      "path": "fixtures/Tenant-B.json"
    },
    {
      "id": "G-low",
      "kind": "grant",
      "path": "fixtures/G-low.json"
    },
    {
      "id": "G-delete",
      "kind": "grant",
      "path": "fixtures/G-delete.json"
    },
    {
      "id": "G-expired",
      "kind": "grant",
      "path": "fixtures/G-expired.json"
    },
    {
      "id": "G-revoked",
      "kind": "grant",
      "path": "fixtures/G-revoked.json"
    },
    {
      "id": "R17",
      "kind": "revision",
      "path": "fixtures/R17.json"
    },
    {
      "id": "R18",
      "kind": "revision",
      "path": "fixtures/R18.json"
    },
    {
      "id": "FP-after-prepared",
      "kind": "failure-point",
      "path": "fixtures/FP-after-prepared.json"
    },
    {
      "id": "FP-after-graph-commit",
      "kind": "failure-point",
      "path": "fixtures/FP-after-graph-commit.json"
    },
    {
      "id": "FP-after-receipt",
      "kind": "failure-point",
      "path": "fixtures/FP-after-receipt.json"
    },
    {
      "id": "FP-before-outbox",
      "kind": "failure-point",
      "path": "fixtures/FP-before-outbox.json"
    },
    {
      "id": "FP-disk-full",
      "kind": "failure-point",
      "path": "fixtures/FP-disk-full.json"
    },
    {
      "id": "FP-rename-failure",
      "kind": "failure-point",
      "path": "fixtures/FP-rename-failure.json"
    },
    {
      "id": "FP-outbox-paused",
      "kind": "failure-point",
      "path": "fixtures/FP-outbox-paused.json"
    }
  ],
  "cases": [
    {
      "id": "DOM-001",
      "priority": "P0",
      "activationPhase": 1,
      "activationState": "planned",
      "suite": "go:workflow-domain",
      "selector": "case=DOM-001",
      "fixtures": [
        "W1"
      ],
      "browsers": [],
      "capabilityTags": [
        "dom",
        "workflow-canvas"
      ],
      "owner": "workflow-domain",
      "evidence": [
        "automation:go:workflow-domain#DOM-001"
      ],
      "expectedOutcome": "pass"
    },
    {
      "id": "DOM-002",
      "priority": "P0",
      "activationPhase": 1,
      "activationState": "planned",
      "suite": "go:workflow-domain",
      "selector": "case=DOM-002",
      "fixtures": [
        "W2"
      ],
      "browsers": [],
      "capabilityTags": [
        "dom",
        "workflow-canvas"
      ],
      "owner": "workflow-domain",
      "evidence": [
        "automation:go:workflow-domain#DOM-002"
      ],
      "expectedOutcome": "pass"
    },
    {
      "id": "DOM-003",
      "priority": "P0",
      "activationPhase": 1,
      "activationState": "planned",
      "suite": "go:workflow-domain",
      "selector": "case=DOM-003",
      "fixtures": [
        "W1"
      ],
      "browsers": [],
      "capabilityTags": [
        "dom",
        "workflow-canvas"
      ],
      "owner": "workflow-domain",
      "evidence": [
        "automation:go:workflow-domain#DOM-003"
      ],
      "expectedOutcome": "pass"
    },
    {
      "id": "DOM-004",
      "priority": "P0",
      "activationPhase": 1,
      "activationState": "planned",
      "suite": "go:workflow-domain",
      "selector": "case=DOM-004",
      "fixtures": [
        "W1"
      ],
      "browsers": [],
      "capabilityTags": [
        "dom",
        "workflow-canvas"
      ],
      "owner": "workflow-domain",
      "evidence": [
        "automation:go:workflow-domain#DOM-004"
      ],
      "expectedOutcome": "pass"
    },
    {
      "id": "DOM-005",
      "priority": "P0",
      "activationPhase": 1,
      "activationState": "planned",
      "suite": "go:workflow-domain",
      "selector": "case=DOM-005",
      "fixtures": [
        "W1"
      ],
      "browsers": [],
      "capabilityTags": [
        "dom",
        "workflow-canvas"
      ],
      "owner": "workflow-domain",
      "evidence": [
        "automation:go:workflow-domain#DOM-005"
      ],
      "expectedOutcome": "pass"
    },
    {
      "id": "DOM-006",
      "priority": "P0",
      "activationPhase": 1,
      "activationState": "planned",
      "suite": "go:workflow-domain",
      "selector": "case=DOM-006",
      "fixtures": [
        "W1"
      ],
      "browsers": [],
      "capabilityTags": [
        "dom",
        "workflow-canvas"
      ],
      "owner": "workflow-domain",
      "evidence": [
        "automation:go:workflow-domain#DOM-006"
      ],
      "expectedOutcome": "pass"
    },
    {
      "id": "DOM-007",
      "priority": "P0",
      "activationPhase": 1,
      "activationState": "planned",
      "suite": "go:workflow-domain",
      "selector": "case=DOM-007",
      "fixtures": [
        "W1"
      ],
      "browsers": [],
      "capabilityTags": [
        "dom",
        "workflow-canvas"
      ],
      "owner": "workflow-domain",
      "evidence": [
        "automation:go:workflow-domain#DOM-007"
      ],
      "expectedOutcome": "pass"
    },
    {
      "id": "DOM-008",
      "priority": "P0",
      "activationPhase": 1,
      "activationState": "planned",
      "suite": "go:workflow-domain",
      "selector": "case=DOM-008",
      "fixtures": [
        "W3",
        "R17",
        "R18"
      ],
      "browsers": [],
      "capabilityTags": [
        "dom",
        "workflow-canvas"
      ],
      "owner": "workflow-domain",
      "evidence": [
        "automation:go:workflow-domain#DOM-008"
      ],
      "expectedOutcome": "pass"
    },
    {
      "id": "DOM-009",
      "priority": "P0",
      "activationPhase": 1,
      "activationState": "planned",
      "suite": "go:workflow-domain",
      "selector": "case=DOM-009",
      "fixtures": [
        "W1"
      ],
      "browsers": [],
      "capabilityTags": [
        "dom",
        "workflow-canvas"
      ],
      "owner": "workflow-domain",
      "evidence": [
        "automation:go:workflow-domain#DOM-009"
      ],
      "expectedOutcome": "pass"
    },
    {
      "id": "DOM-010",
      "priority": "P0",
      "activationPhase": 1,
      "activationState": "planned",
      "suite": "go:workflow-domain",
      "selector": "case=DOM-010",
      "fixtures": [
        "W1"
      ],
      "browsers": [],
      "capabilityTags": [
        "dom",
        "workflow-canvas"
      ],
      "owner": "workflow-domain",
      "evidence": [
        "automation:go:workflow-domain#DOM-010"
      ],
      "expectedOutcome": "pass"
    },
    {
      "id": "DOM-011",
      "priority": "P0",
      "activationPhase": 1,
      "activationState": "planned",
      "suite": "go:workflow-domain",
      "selector": "case=DOM-011",
      "fixtures": [
        "W1"
      ],
      "browsers": [],
      "capabilityTags": [
        "dom",
        "workflow-canvas"
      ],
      "owner": "workflow-domain",
      "evidence": [
        "automation:go:workflow-domain#DOM-011"
      ],
      "expectedOutcome": "pass"
    },
    {
      "id": "DOM-012",
      "priority": "P0",
      "activationPhase": 1,
      "activationState": "planned",
      "suite": "go:workflow-domain",
      "selector": "case=DOM-012",
      "fixtures": [
        "W1"
      ],
      "browsers": [],
      "capabilityTags": [
        "dom",
        "workflow-canvas"
      ],
      "owner": "workflow-domain",
      "evidence": [
        "automation:go:workflow-domain#DOM-012"
      ],
      "expectedOutcome": "pass"
    },
    {
      "id": "MCP-001",
      "priority": "P0",
      "activationPhase": 2,
      "activationState": "planned",
      "suite": "go:workflow-mcp",
      "selector": "case=MCP-001",
      "fixtures": [
        "W2",
        "U-edit",
        "Tenant-A"
      ],
      "browsers": [],
      "capabilityTags": [
        "mcp",
        "workflow-canvas"
      ],
      "owner": "workflow-mcp",
      "evidence": [
        "automation:go:workflow-mcp#MCP-001"
      ],
      "expectedOutcome": "pass"
    },
    {
      "id": "MCP-002",
      "priority": "P0",
      "activationPhase": 2,
      "activationState": "planned",
      "suite": "go:workflow-mcp",
      "selector": "case=MCP-002",
      "fixtures": [
        "W2",
        "U-edit",
        "Tenant-A"
      ],
      "browsers": [],
      "capabilityTags": [
        "mcp",
        "workflow-canvas"
      ],
      "owner": "workflow-mcp",
      "evidence": [
        "automation:go:workflow-mcp#MCP-002"
      ],
      "expectedOutcome": "pass"
    },
    {
      "id": "MCP-003",
      "priority": "P0",
      "activationPhase": 2,
      "activationState": "planned",
      "suite": "go:workflow-mcp",
      "selector": "case=MCP-003",
      "fixtures": [
        "W2",
        "U-edit",
        "Tenant-A"
      ],
      "browsers": [],
      "capabilityTags": [
        "mcp",
        "workflow-canvas"
      ],